{
  "$schema": "https://json-schema.org/draft/2020-12/schema",
  "$id": "https://nodehost.example/schema/gate-evidence-v1.json",
  "type": "object",
  "additionalProperties": false,
  "required": [
    "schemaVersion",
    "gateId",
    "status",
    "recordedAt",
    "gitCommit",
    "command",
    "summary",
    "artifacts"
  ],
  "properties": {
    "schemaVersion": {"const": 1},
    "gateId": {"pattern": "^[BU][0-9]{2}$"},
    "status": {
      "enum": ["PASS", "FAIL", "BLOCKED-HARDWARE", "DEFERRED"]
    },
    "recordedAt": {"type": "string", "format": "date-time"},
    "gitCommit": {"type": "string", "pattern": "^[0-9a-f]{7,40}$"},
    "command": {"type": "string", "minLength": 1, "maxLength": 2000},
    "summary": {"type": "string", "minLength": 1, "maxLength": 2000},
    "environment": {
      "type": "object",
      "additionalProperties": {"type": ["string", "number", "boolean", "null"]}
    },
    "artifacts": {
      "type": "array",
      "items": {
        "type": "object",
        "additionalProperties": false,
        "required": ["path"],
        "properties": {
          "path": {"type": "string", "minLength": 1},
          "sha256": {"type": ["string", "null"], "pattern": "^[0-9a-f]{64}$"},
          "note": {"type": ["string", "null"], "maxLength": 500}
        }
      }
    }
  }
}
