{
  "schemaVersion": 1,
  "gateId": "B01",
  "status": "PASS",
  "recordedAt": "2026-07-29T16:52:20.867773+00:00",
  "gitCommit": "cdf65b20a8e28abd9b9b930ffec35fb73da76a6d",
  "command": "cd android/podroid && ./gradlew test :app:lintDebug :app:assembleDebug :mesh-tailscale:assembleRelease :app:verifyPodroidPackaging",
  "summary": "Pinned Podroid sources are present; the current integrated debug application and mesh release artifact assemble in the clean full build.",
  "environment": {},
  "artifacts": [
    {
      "path": "evidence/T08/qa-summary.txt",
      "sha256": "d6f1e0dfcce77286b41003354d80b8237d49ca54f0365ca519496d660b930fd5",
      "note": null
    }
  ]
}
