{
  "schemaVersion": 1,
  "gateId": "B15",
  "status": "PASS",
  "recordedAt": "2026-07-29T16:52:20.867773+00:00",
  "gitCommit": "cdf65b20a8e28abd9b9b930ffec35fb73da76a6d",
  "command": "cd android/podroid && ./gradlew :node-shell:testDebugUnitTest --tests 'org.nodehost.shell.AndroidQemuRuntimeBackendTest.mutableSystemStateSurvivesRepeatedPreparationAfterBootstrapConsumption' --tests 'org.nodehost.shell.AndroidQemuRuntimeBackendTest.*Data*'",
  "summary": "Focused disk tests prove mutable system state is not recreated and designated data is atomically preserved, reattached, and retained on move failure.",
  "environment": {},
  "artifacts": [
    {
      "path": "evidence/T08/qa-summary.txt",
      "sha256": "d6f1e0dfcce77286b41003354d80b8237d49ca54f0365ca519496d660b930fd5",
      "note": null
    }
  ]
}
