{
  "schemaVersion": 1,
  "gateId": "B05",
  "status": "PASS",
  "recordedAt": "2026-07-29T14:23:42.949918+00:00",
  "gitCommit": "2fecba108b6ed248a8201a812a288148b1886f80",
  "command": "make test-guest",
  "summary": "Guest-init and K3s qualification report checks pass without claiming a live guest.",
  "environment": {},
  "artifacts": [
    {
      "path": "evidence/T08/qa-summary.txt",
      "sha256": "358d1d75829a96654e72e217cbb387bfaa6c6cf3b6f33521559098d799dc2791",
      "note": null
    }
  ]
}
