{
  "schemaVersion": 1,
  "gateId": "U03",
  "status": "DEFERRED",
  "recordedAt": "2026-07-29T14:23:43.923415+00:00",
  "gitCommit": "2fecba108b6ed248a8201a812a288148b1886f80",
  "command": "python3 tools/ci/check-mvp-plus-gate.py --report-only",
  "summary": "MVP+ USB work remains deferred because not every base gate is PASS.",
  "environment": {},
  "artifacts": [
    {
      "path": "evidence/T08/qa-summary.txt",
      "sha256": "358d1d75829a96654e72e217cbb387bfaa6c6cf3b6f33521559098d799dc2791",
      "note": null
    }
  ]
}
