{
  "schemaVersion": 1,
  "gateId": "B09",
  "status": "BLOCKED-HARDWARE",
  "recordedAt": "2026-07-29T14:23:43.166233+00:00",
  "gitCommit": "2fecba108b6ed248a8201a812a288148b1886f80",
  "command": "tests/e2e/run.sh",
  "summary": "Authenticated fake Host API path passes, but live API reachability through host mesh was not run.",
  "environment": {},
  "artifacts": [
    {
      "path": "evidence/T08/qa-summary.txt",
      "sha256": "d6f1e0dfcce77286b41003354d80b8237d49ca54f0365ca519496d660b930fd5",
      "note": null
    }
  ]
}
