{
  "schemaVersion": 1,
  "gateId": "B18",
  "status": "PASS",
  "recordedAt": "2026-07-29T16:06:00.752648+00:00",
  "gitCommit": "7120316e69ad27b47a54108bd92ef49f94161a5a",
  "command": "python3 tools/ci/check-release-surface.py && python3 tools/ci/check-secrets.py && python3 tools/ci/check-openapi.py",
  "summary": "Current static release, secret, and API scans find no default-password or raw shell/QMP/argv surface.",
  "environment": {},
  "artifacts": [
    {
      "path": "evidence/T08/qa-summary.txt",
      "sha256": "f01667f353b6c5cfa46d5122591a4a48bb38ad8abe8d45a2696f1cce7b3eeb70",
      "note": null
    }
  ]
}
