{
  "schemaVersion": 1,
  "gateId": "B11",
  "status": "BLOCKED-HARDWARE",
  "recordedAt": "2026-07-29T14:23:43.272108+00:00",
  "gitCommit": "2fecba108b6ed248a8201a812a288148b1886f80",
  "command": "tests/e2e/run.sh",
  "summary": "Key-only bootstrap and distinct fake credentials pass; no live guest identity was enrolled.",
  "environment": {},
  "artifacts": [
    {
      "path": "evidence/T08/qa-summary.txt",
      "sha256": "d6f1e0dfcce77286b41003354d80b8237d49ca54f0365ca519496d660b930fd5",
      "note": null
    }
  ]
}
