{
  "schemaVersion": 1,
  "gateId": "B06",
  "status": "PASS",
  "recordedAt": "2026-07-29T16:06:00.582605+00:00",
  "gitCommit": "7120316e69ad27b47a54108bd92ef49f94161a5a",
  "command": "python3 -m unittest tests/contracts/test_contracts.py && cd android/podroid && ./gradlew :node-shell:testDebugUnitTest --tests 'org.nodehost.shell.VerticalIntegrationTest.restartConvergesAfterEveryEnrollmentBoundaryWithoutDuplicateAuthorityOrDesiredStateLoss'",
  "summary": "Strict enrollment contracts and recovery after every durable enrollment phase pass without duplicate authority or desired-state loss.",
  "environment": {},
  "artifacts": [
    {
      "path": "evidence/T08/qa-summary.txt",
      "sha256": "f01667f353b6c5cfa46d5122591a4a48bb38ad8abe8d45a2696f1cce7b3eeb70",
      "note": null
    }
  ]
}
